{"capacity_status":"ok","changed_partitions":["2026-07-22","2026-08-10","2026-08-11"],"closed_complete_through":"2026-08-10","enrichment_backlog_count":0,"enrichment_oldest_age_hours":null,"estimated_reachable_pack_size_bytes":71260900,"feed_id":"physical-ai-arxiv-facts-v1","feed_root_sha256":"sha256:37fe1370c0cf64201157ae29808c278197d941ceba305f1bdade2a5934bcb60e","index_sha256":"sha256:2165732ef6b445884fab6166e4cefb82e69cd06f94f4548f3319e6e6e4e5f40e","last_workflow_success_at":"2026-08-11T02:39:56Z","latest_query_complete_at":"2026-08-11T02:39:56Z","membership_closed_through":"2026-08-10","operation_counts":{"producer_retract":0,"scope_exit":0,"source_delete":0,"upsert":1886},"pending_gaps":[],"provisional_dates":["2026-08-11"],"reachable_pack_size_bytes":68075255,"scope_id":"physical-ai-v1","snapshot_kind":"ordinary","status_schema_version":"1.0","workflow_run_url":"https://github.com/Yeah2333/physical-ai-arxiv-feed/actions/runs/31452818584"}
